{"blocks":2,"case_id":"k-64","error_bound":{"comparator":"dfq8_forward_v1","policy":"strict_f32_v1"},"expected_output_fp32_bits":[3224800538],"expected_q_bytes":[127,-64,127,-64,127,-64,127,-64,127,-64,127,-64,127,-64,127,-64,127,-64,127,-64,127,-64,127,-64,127,-64,127,-64,127,-64,127,-64,127,-64,127,-64,127,-64,127,-64,127,-64,127,-64,127,-64,127,-64,127,-64,127,-64,127,-64,127,-64,127,-64,127,-64,127,-64,127,-64],"expected_scale_bits":[1006699012,1006699012],"fixture_identity":"sha256:59168d03ff6d7ef7fb688e1bdd7d3ef31185b9a3da121fa503c57cabf5a80c13","format":"DFQ8_B32_V1","input_fp32_bits":[3212836864,1048576000,1048576000,3212836864,1048576000,1048576000,3212836864,1048576000,1048576000,3212836864,1048576000,1048576000,3212836864,1048576000,1048576000,3212836864,1048576000,1048576000,3212836864,1048576000,1048576000,3212836864,1048576000,1048576000,3212836864,1048576000,1048576000,3212836864,1048576000,1048576000,3212836864,1048576000,1048576000,3212836864,1048576000,1048576000,3212836864,1048576000,1048576000,3212836864,1048576000,1048576000,3212836864,1048576000,1048576000,3212836864,1048576000,1048576000,3212836864,1048576000,1048576000,3212836864,1048576000,1048576000,3212836864,1048576000,1048576000,3212836864,1048576000,1048576000,3212836864,1048576000,1048576000,3212836864],"k":64,"logical_weight_identity":"sha256:1c929793757d63739f4cd4a20001e49d3b9492e472574b19e780ae5c1a379988","n":1,"numeric_mode":"strict_f32_v1","operator":"q8_linear","operator_version":"q8_linear_v1","schema_version":1,"source_fp32_bits":[1065353216,3204448256,1065353216,3204448256,1065353216,3204448256,1065353216,3204448256,1065353216,3204448256,1065353216,3204448256,1065353216,3204448256,1065353216,3204448256,1065353216,3204448256,1065353216,3204448256,1065353216,3204448256,1065353216,3204448256,1065353216,3204448256,1065353216,3204448256,1065353216,3204448256,1065353216,3204448256,1065353216,3204448256,1065353216,3204448256,1065353216,3204448256,1065353216,3204448256,1065353216,3204448256,1065353216,3204448256,1065353216,3204448256,1065353216,3204448256,1065353216,3204448256,1065353216,3204448256,1065353216,3204448256,1065353216,3204448256,1065353216,3204448256,1065353216,3204448256,1065353216,3204448256,1065353216,3204448256]}
