{"blocks":1,"case_id":"k-32","error_bound":{"comparator":"dfq8_forward_v1","policy":"strict_f32_v1"},"expected_output_fp32_bits":[3222761182],"expected_q_bytes":[127,-64,127,-64,127,-64,127,-64,127,-64,127,-64,127,-64,127,-64,127,-64,127,-64,127,-64,127,-64,127,-64,127,-64,127,-64,127,-64],"expected_scale_bits":[1006699012],"fixture_identity":"sha256:82d895f094f3d7bbd88b503ebbae24651f8d90f7e9bbc2538d3a393e86d86295","format":"DFQ8_B32_V1","input_fp32_bits":[3212836864,1048576000,1048576000,3212836864,1048576000,1048576000,3212836864,1048576000,1048576000,3212836864,1048576000,1048576000,3212836864,1048576000,1048576000,3212836864,1048576000,1048576000,3212836864,1048576000,1048576000,3212836864,1048576000,1048576000,3212836864,1048576000,1048576000,3212836864,1048576000,1048576000,3212836864,1048576000],"k":32,"logical_weight_identity":"sha256:d038b6a8cdc17b44f193f3b7f97cafba472866ad4fd65188d15b9fc58c806401","n":1,"numeric_mode":"strict_f32_v1","operator":"q8_linear","operator_version":"q8_linear_v1","schema_version":1,"source_fp32_bits":[1065353216,3204448256,1065353216,3204448256,1065353216,3204448256,1065353216,3204448256,1065353216,3204448256,1065353216,3204448256,1065353216,3204448256,1065353216,3204448256,1065353216,3204448256,1065353216,3204448256,1065353216,3204448256,1065353216,3204448256,1065353216,3204448256,1065353216,3204448256,1065353216,3204448256,1065353216,3204448256]}
