{"blocks":1,"case_id":"k-31","error_bound":{"comparator":"dfq8_forward_v1","policy":"strict_f32_v1"},"expected_output_fp32_bits":[3222232765],"expected_q_bytes":[127,-64,127,-64,127,-64,127,-64,127,-64,127,-64,127,-64,127,-64,127,-64,127,-64,127,-64,127,-64,127,-64,127,-64,127,-64,127,0],"expected_scale_bits":[1006699012],"fixture_identity":"sha256:793e154217ac0d72ef4947fd1445423c965cf36ee341b29e7098383a55c2f60c","format":"DFQ8_B32_V1","input_fp32_bits":[3212836864,1048576000,1048576000,3212836864,1048576000,1048576000,3212836864,1048576000,1048576000,3212836864,1048576000,1048576000,3212836864,1048576000,1048576000,3212836864,1048576000,1048576000,3212836864,1048576000,1048576000,3212836864,1048576000,1048576000,3212836864,1048576000,1048576000,3212836864,1048576000,1048576000,3212836864],"k":31,"logical_weight_identity":"sha256:b44939ea6541116c21a54b0907238863c99c3ba0645a62fc16566471c5b7ec15","n":1,"numeric_mode":"strict_f32_v1","operator":"q8_linear","operator_version":"q8_linear_v1","schema_version":1,"source_fp32_bits":[1065353216,3204448256,1065353216,3204448256,1065353216,3204448256,1065353216,3204448256,1065353216,3204448256,1065353216,3204448256,1065353216,3204448256,1065353216,3204448256,1065353216,3204448256,1065353216,3204448256,1065353216,3204448256,1065353216,3204448256,1065353216,3204448256,1065353216,3204448256,1065353216,3204448256,1065353216]}
