{"blocks":2,"case_id":"k-63","error_bound":{"comparator":"dfq8_forward_v1","policy":"strict_f32_v1"},"expected_output_fp32_bits":[3226914204],"expected_q_bytes":[127,-64,127,-64,127,-64,127,-64,127,-64,127,-64,127,-64,127,-64,127,-64,127,-64,127,-64,127,-64,127,-64,127,-64,127,-64,127,-64,127,-64,127,-64,127,-64,127,-64,127,-64,127,-64,127,-64,127,-64,127,-64,127,-64,127,-64,127,-64,127,-64,127,-64,127,-64,127,0],"expected_scale_bits":[1006699012,1006699012],"fixture_identity":"sha256:d450588b5bddac799fe2b63a73f43d46ecd81cd96b6aa2a86b996b254fa75245","format":"DFQ8_B32_V1","input_fp32_bits":[3212836864,1048576000,1048576000,3212836864,1048576000,1048576000,3212836864,1048576000,1048576000,3212836864,1048576000,1048576000,3212836864,1048576000,1048576000,3212836864,1048576000,1048576000,3212836864,1048576000,1048576000,3212836864,1048576000,1048576000,3212836864,1048576000,1048576000,3212836864,1048576000,1048576000,3212836864,1048576000,1048576000,3212836864,1048576000,1048576000,3212836864,1048576000,1048576000,3212836864,1048576000,1048576000,3212836864,1048576000,1048576000,3212836864,1048576000,1048576000,3212836864,1048576000,1048576000,3212836864,1048576000,1048576000,3212836864,1048576000,1048576000,3212836864,1048576000,1048576000,3212836864,1048576000,1048576000],"k":63,"logical_weight_identity":"sha256:e5e7b5e73fcdcc7a0373160a50c31adb1ffdafb48ac03bc61c9fa125e9ea086b","n":1,"numeric_mode":"strict_f32_v1","operator":"q8_linear","operator_version":"q8_linear_v1","schema_version":1,"source_fp32_bits":[1065353216,3204448256,1065353216,3204448256,1065353216,3204448256,1065353216,3204448256,1065353216,3204448256,1065353216,3204448256,1065353216,3204448256,1065353216,3204448256,1065353216,3204448256,1065353216,3204448256,1065353216,3204448256,1065353216,3204448256,1065353216,3204448256,1065353216,3204448256,1065353216,3204448256,1065353216,3204448256,1065353216,3204448256,1065353216,3204448256,1065353216,3204448256,1065353216,3204448256,1065353216,3204448256,1065353216,3204448256,1065353216,3204448256,1065353216,3204448256,1065353216,3204448256,1065353216,3204448256,1065353216,3204448256,1065353216,3204448256,1065353216,3204448256,1065353216,3204448256,1065353216,3204448256,1065353216]}
