{"blocks":2,"case_id":"random-sha256-counter","error_bound":{"comparator":"dfq8_forward_v1","policy":"strict_f32_v1"},"expected_output_fp32_bits":[3198118167,991292480,3180399306],"expected_q_bytes":[-127,-99,81,103,74,-84,-116,-85,121,-109,69,105,-113,94,-76,-74,121,65,67,-124,-65,95,-96,84,72,124,104,70,-68,-114,-67,-111,127,0,0,0,0,0,0,0,0,0,0,0,0,0,0,0,0,0,0,0,0,0,0,0,0,0,0,0,0,0,0,0,88,114,-98,72,-98,118,-66,122,102,81,-74,127,-80,-110,-68,89,68,93,110,-67,119,79,105,99,123,100,-109,-79,66,99,-122,121,-127,0,0,0,0,0,0,0,0,0,0,0,0,0,0,0,0,0,0,0,0,0,0,0,0,0,0,0,0,0,0,0,-102,-71,78,97,102,73,-70,-100,118,75,85,-96,105,-69,127,68,68,83,99,-86,-119,-68,105,117,85,-64,67,111,66,97,125,83,127,0,0,0,0,0,0,0,0,0,0,0,0,0,0,0,0,0,0,0,0,0,0,0,0,0,0,0,0,0,0,0],"expected_scale_bits":[989897600,984877261,989465553,986857323,989900008,981836942],"fixture_identity":"sha256:08dd38dbcfb50f5c2a13ab90a98eb2a364bcc20d2462e8a6f6e4149027336784","format":"DFQ8_B32_V1","input_fp32_bits":[1046845728,1047532148,1042853588,3193345282,3187941953,1042883644,1046936561,3193797393,3194751364,1042342381,1041773623,1045325183,1045970756,1048197932,1046020527,1043342193,1043949818,3190041480,3189959602,3188080455,3191409007,1046109225,1040879201,1043891079,3194957462,3193456448,3188725212,3187770933,1044013833,1042785998,3192033052,3192977327,3189282099],"k":33,"logical_weight_identity":"sha256:2bbad05f260b089c7175f19bf1e48b4175a416704bbd8c61012ae9555539a745","n":3,"numeric_mode":"strict_f32_v1","operator":"q8_linear","operator_version":"q8_linear_v1","schema_version":1,"source_fp32_bits":[3196011634,3192309635,1042463899,1045414323,1041541955,3190382883,3194534054,3190484728,1047706440,3193629033,1040835340,1045682863,3194209292,1044201866,3189350365,3189010400,1047686662,1040307381,1040573745,3195616491,3187894831,1044264509,3191884824,1042920602,1041321382,1048190661,1045463697,1040976700,3188296423,3194301016,3188092813,3193937354,1043505339,1043084812,1046385328,3191883380,1041023356,3191883318,1046854577,3187736681,1047408525,1044873405,1042158744,3188801218,1048057785,3189537463,3193339338,3188029455,1043154479,1040493061,1043757134,1045896995,3187800797,1047049807,1041863078,1045190573,1044479428,1047496869,1044559657,3193195295,3189358999,1040207491,1044422438,3194878741,1047258661,3192953580,3192733336,3188600895,1042031876,1044557699,1045252054,1041465521,3188444987,3192397248,1047354217,1041678128,1043010856,3191951151,1045583211,3188341201,1048532764,1040807702,1040799379,1042785781,1044864496,3190612675,3194911323,3188257742,1045695149,1047251281,1042990162,3187702553,1040679572,1046461195,1040471893,1044526458,1048209471,1042724402,1040488773]}
