{"blocks":1,"case_id":"k-01","error_bound":{"comparator":"dfq8_forward_v1","policy":"strict_f32_v1"},"expected_output_fp32_bits":[3212836864],"expected_q_bytes":[127,0,0,0,0,0,0,0,0,0,0,0,0,0,0,0,0,0,0,0,0,0,0,0,0,0,0,0,0,0,0,0],"expected_scale_bits":[1006699012],"fixture_identity":"sha256:aada34c5a4d34f62de43643a67ddeec988d88b531e11c1b8b63cf704d4132a1b","format":"DFQ8_B32_V1","input_fp32_bits":[3212836864],"k":1,"logical_weight_identity":"sha256:fc575438eccd8c69cf8ac029da89ebf1df970e3583a3444c9872215785fede37","n":1,"numeric_mode":"strict_f32_v1","operator":"q8_linear","operator_version":"q8_linear_v1","schema_version":1,"source_fp32_bits":[1065353216]}
