{"blocks":1,"case_id":"subnormal-scale-min","error_bound":{"comparator":"dfq8_forward_v1","policy":"strict_f32_v1"},"expected_output_fp32_bits":[96],"expected_q_bytes":[64,-32,0,0,0,0,0,0,0,0,0,0,0,0,0,0,0,0,0,0,0,0,0,0,0,0,0,0,0,0,0,0],"expected_scale_bits":[1],"fixture_identity":"sha256:da41627f4ba5b7bb94f9c4d34d542a0e6fbbc871a548ccbf73837c48603e4451","format":"DFQ8_B32_V1","input_fp32_bits":[1065353216,3212836864],"k":2,"logical_weight_identity":"sha256:9b56859fbef2e8e7681b0028d2d96204cdfee099b138871b8a8041f7d1c8065d","n":1,"numeric_mode":"strict_f32_v1","operator":"q8_linear","operator_version":"q8_linear_v1","schema_version":1,"source_fp32_bits":[64,2147483680]}
