{"blocks":1,"case_id":"subnormal-scale-zero","error_bound":{"comparator":"dfq8_forward_v1","policy":"strict_f32_v1"},"expected_output_fp32_bits":[0],"expected_q_bytes":[0,0,0,0,0,0,0,0,0,0,0,0,0,0,0,0,0,0,0,0,0,0,0,0,0,0,0,0,0,0,0,0],"expected_scale_bits":[0],"fixture_identity":"sha256:5475a055b3dcd50708498a74f2f792bb1e18c38cb7701ce5fc1d49957a28dedc","format":"DFQ8_B32_V1","input_fp32_bits":[1065353216],"k":1,"logical_weight_identity":"sha256:9112ac7cfea1ecfb8ccc13c29526a82b47b0c45725d27f484f529c008ced0b52","n":1,"numeric_mode":"strict_f32_v1","operator":"q8_linear","operator_version":"q8_linear_v1","schema_version":1,"source_fp32_bits":[63]}
