{"blocks":1,"case_id":"finite-extremes","error_bound":{"comparator":"dfq8_forward_v1","policy":"strict_f32_v1"},"expected_output_fp32_bits":[0],"expected_q_bytes":[127,-127,0,0,0,0,0,0,0,0,0,0,0,0,0,0,0,0,0,0,0,0,0,0,0,0,0,0,0,0,0,0],"expected_scale_bits":[2080440836],"fixture_identity":"sha256:14174beb112a69f38337478522b2ad3e88bc66649e6b2b3da40167859c15ea8e","format":"DFQ8_B32_V1","input_fp32_bits":[0,0,0,0,0,0],"k":6,"logical_weight_identity":"sha256:a7f03b1afa0ee6cc152bf377477b30cd5b513606411c0a5dc15f78383edddd24","n":1,"numeric_mode":"strict_f32_v1","operator":"q8_linear","operator_version":"q8_linear_v1","schema_version":1,"source_fp32_bits":[2139095039,4286578687,8388608,2155872256,1,2147483649]}
