{"blocks":1,"case_id":"ties-and-extrema","error_bound":{"comparator":"dfq8_forward_v1","policy":"strict_f32_v1"},"expected_output_fp32_bits":[0],"expected_q_bytes":[127,-127,2,4,-2,-4,0,0,0,0,0,0,0,0,0,0,0,0,0,0,0,0,0,0,0,0,0,0,0,0,0,0],"expected_scale_bits":[1065353216],"fixture_identity":"sha256:59c78d08e248d2614646112cd6b2c7ea88d73fee06e9a0eddff93b4ed4a3ee71","format":"DFQ8_B32_V1","input_fp32_bits":[1065353216,1065353216,1065353216,1065353216,1065353216,1065353216,1065353216,1065353216],"k":8,"logical_weight_identity":"sha256:af446cbe6acbb02b01869717b2078346c692f268c16c8be69d075cd265837943","n":1,"numeric_mode":"strict_f32_v1","operator":"q8_linear","operator_version":"q8_linear_v1","schema_version":1,"source_fp32_bits":[1123942400,3271426048,1075838976,1080033280,3223322624,3227516928,0,2147483648]}
