{"blocks":3,"case_id":"k-65","error_bound":{"comparator":"dfq8_forward_v1","policy":"strict_f32_v1"},"expected_output_fp32_bits":[3223751962],"expected_q_bytes":[127,-64,127,-64,127,-64,127,-64,127,-64,127,-64,127,-64,127,-64,127,-64,127,-64,127,-64,127,-64,127,-64,127,-64,127,-64,127,-64,127,-64,127,-64,127,-64,127,-64,127,-64,127,-64,127,-64,127,-64,127,-64,127,-64,127,-64,127,-64,127,-64,127,-64,127,-64,127,-64,127,0,0,0,0,0,0,0,0,0,0,0,0,0,0,0,0,0,0,0,0,0,0,0,0,0,0,0,0,0,0,0],"expected_scale_bits":[1006699012,1006699012,1006699012],"fixture_identity":"sha256:2c8c22a1d887132a2577e1adcc92faedf5c0ad6acda2d12ebe0eef076efc2745","format":"DFQ8_B32_V1","input_fp32_bits":[3212836864,1048576000,1048576000,3212836864,1048576000,1048576000,3212836864,1048576000,1048576000,3212836864,1048576000,1048576000,3212836864,1048576000,1048576000,3212836864,1048576000,1048576000,3212836864,1048576000,1048576000,3212836864,1048576000,1048576000,3212836864,1048576000,1048576000,3212836864,1048576000,1048576000,3212836864,1048576000,1048576000,3212836864,1048576000,1048576000,3212836864,1048576000,1048576000,3212836864,1048576000,1048576000,3212836864,1048576000,1048576000,3212836864,1048576000,1048576000,3212836864,1048576000,1048576000,3212836864,1048576000,1048576000,3212836864,1048576000,1048576000,3212836864,1048576000,1048576000,3212836864,1048576000,1048576000,3212836864,1048576000],"k":65,"logical_weight_identity":"sha256:88f1020d4a2d91e2744b22b4f5b713c61fd9508aa55e5da90c231a55dd5b48ce","n":1,"numeric_mode":"strict_f32_v1","operator":"q8_linear","operator_version":"q8_linear_v1","schema_version":1,"source_fp32_bits":[1065353216,3204448256,1065353216,3204448256,1065353216,3204448256,1065353216,3204448256,1065353216,3204448256,1065353216,3204448256,1065353216,3204448256,1065353216,3204448256,1065353216,3204448256,1065353216,3204448256,1065353216,3204448256,1065353216,3204448256,1065353216,3204448256,1065353216,3204448256,1065353216,3204448256,1065353216,3204448256,1065353216,3204448256,1065353216,3204448256,1065353216,3204448256,1065353216,3204448256,1065353216,3204448256,1065353216,3204448256,1065353216,3204448256,1065353216,3204448256,1065353216,3204448256,1065353216,3204448256,1065353216,3204448256,1065353216,3204448256,1065353216,3204448256,1065353216,3204448256,1065353216,3204448256,1065353216,3204448256,1065353216]}
