{"blocks":1,"case_id":"zero-signed-zero","error_bound":{"comparator":"dfq8_forward_v1","policy":"strict_f32_v1"},"expected_output_fp32_bits":[0],"expected_q_bytes":[0,0,0,0,0,0,0,0,0,0,0,0,0,0,0,0,0,0,0,0,0,0,0,0,0,0,0,0,0,0,0,0],"expected_scale_bits":[0],"fixture_identity":"sha256:98e657f34adae8d9d69a1bf3603c1c8f592de9eb1b8abd89f68edfc0a73c5112","format":"DFQ8_B32_V1","input_fp32_bits":[2147483648],"k":1,"logical_weight_identity":"sha256:9112ac7cfea1ecfb8ccc13c29526a82b47b0c45725d27f484f529c008ced0b52","n":1,"numeric_mode":"strict_f32_v1","operator":"q8_linear","operator_version":"q8_linear_v1","schema_version":1,"source_fp32_bits":[2147483648]}
