{"blocks":1,"case_id":"subnormal-clamp","error_bound":{"comparator":"dfq8_forward_v1","policy":"strict_f32_v1"},"expected_output_fp32_bits":[0],"expected_q_bytes":[127,-127,0,0,0,0,0,0,0,0,0,0,0,0,0,0,0,0,0,0,0,0,0,0,0,0,0,0,0,0,0,0],"expected_scale_bits":[1],"fixture_identity":"sha256:fe04450508dc1021b5758de8704ce1d7e7373683dec7c5702116cb15fc917d78","format":"DFQ8_B32_V1","input_fp32_bits":[1065353216,1065353216],"k":2,"logical_weight_identity":"sha256:f5666082cfcfe76089ec78e327ef5fc2462fb2579a9a71d061b81df582d00459","n":1,"numeric_mode":"strict_f32_v1","operator":"q8_linear","operator_version":"q8_linear_v1","schema_version":1,"source_fp32_bits":[190,2147483838]}
