{"blocks":3,"case_id":"mixed-signs-tail","error_bound":{"comparator":"dfq8_forward_v1","policy":"strict_f32_v1"},"expected_output_fp32_bits":[1123868440,3271352088],"expected_q_bytes":[4,-8,12,-16,20,-24,28,-32,36,-40,44,-48,52,-56,60,-64,67,-71,75,-79,83,-87,91,-95,99,-103,107,-111,115,-119,123,-127,65,-67,69,-71,73,-75,77,-79,81,-83,85,-87,89,-91,93,-95,97,-99,101,-103,105,-107,109,-111,113,-115,117,-119,121,-123,125,-127,127,0,0,0,0,0,0,0,0,0,0,0,0,0,0,0,0,0,0,0,0,0,0,0,0,0,0,0,0,0,0,0,-4,8,-12,16,-20,24,-28,32,-36,40,-44,48,-52,56,-60,64,-67,71,-75,79,-83,87,-91,95,-99,103,-107,111,-115,119,-123,127,-65,67,-69,71,-73,75,-77,79,-81,83,-85,87,-89,91,-93,95,-97,99,-101,103,-105,107,-109,111,-113,115,-117,119,-121,123,-125,127,-127,0,0,0,0,0,0,0,0,0,0,0,0,0,0,0,0,0,0,0,0,0,0,0,0,0,0,0,0,0,0,0],"expected_scale_bits":[1014159006,1022547614,1022796281,1014159006,1022547614,1022796281],"fixture_identity":"sha256:f6d5773fc105e960a1b951ca5bcfc07023ddcbf9033019f7d73be8385ca33f08","format":"DFQ8_B32_V1","input_fp32_bits":[1067450368,3208642560,1067450368,3208642560,1067450368,3208642560,1067450368,3208642560,1067450368,3208642560,1067450368,3208642560,1067450368,3208642560,1067450368,3208642560,1067450368,3208642560,1067450368,3208642560,1067450368,3208642560,1067450368,3208642560,1067450368,3208642560,1067450368,3208642560,1067450368,3208642560,1067450368,3208642560,1067450368,3208642560,1067450368,3208642560,1067450368,3208642560,1067450368,3208642560,1067450368,3208642560,1067450368,3208642560,1067450368,3208642560,1067450368,3208642560,1067450368,3208642560,1067450368,3208642560,1067450368,3208642560,1067450368,3208642560,1067450368,3208642560,1067450368,3208642560,1067450368,3208642560,1067450368,3208642560,1067450368],"k":65,"logical_weight_identity":"sha256:abb6d552e6989fd3a226d14d9bbefd0e1830b958b2b5293d4aa1e06983ab3b3a","n":2,"numeric_mode":"strict_f32_v1","operator":"q8_linear","operator_version":"q8_linear_v1","schema_version":1,"source_fp32_bits":[1030811889,3186684145,1043641525,3195072753,1050056343,3199513781,1054003923,3203461361,1057458056,3205928599,1059431846,3207902389,1061405636,3209876179,1063379426,3211849969,1065353216,3213330312,1066340111,3214317207,1067327006,3215304102,1068313901,3216290997,1069300796,3217277892,1070287691,3218264787,1071274586,3219251682,1072261481,3220238577,1073248376,3221225472,1073988548,3221718920,1074481995,3222212367,1074975443,3222705815,1075468890,3223199262,1075962338,3223692710,1076455785,3224186157,1076949233,3224679605,1077442680,3225173052,1077936128,3225666500,1078429576,3226159947,1078923023,3226653395,1079416471,3227146842,1079909918,3227640290,1080403366,3228133737,1080896813,3228627185,1081390261,3178295537,1039200497,3191125173,1047589105,3197539991,1052030133,3201487571,1055977713,3204941704,1058444951,3206915494,1060418741,3208889284,1062392531,3210863074,1064366321,3212836864,1065846664,3213823759,1066833559,3214810654,1067820454,3215797549,1068807349,3216784444,1069794244,3217771339,1070781139,3218758234,1071768034,3219745129,1072754929,3220732024,1073741824,3221472196,1074235272,3221965643,1074728719,3222459091,1075222167,3222952538,1075715614,3223445986,1076209062,3223939433,1076702509,3224432881,1077195957,3224926328,1077689404,3225419776,1078182852,3225913224,1078676299,3226406671,1079169747,3226900119,1079663194,3227393566,1080156642,3227887014,1080650089,3228380461,1081143537,3228873909]}
